{
  "protocol_version": "0.4",
  "status": "blocked",
  "task_id": "",
  "task_summary": "No task has been executed yet.",
  "scope_followed": true,
  "files_read": [],
  "refs_read": [],
  "files_changed": [],
  "commands_run": [],
  "verification": {
    "level": "none",
    "passed": false,
    "evidence": []
  },
  "evidence": {
    "git_diff_summary": "",
    "changed_files_from_git": [],
    "command_outputs": [],
    "unverified_claims": []
  },
  "assumptions": [],
  "issues": [
    "No current task executed."
  ],
  "next": [
    "Fill ai/task.md and run the AI Execution Prompt."
  ],
  "runtime_update": {
    "required": false,
    "changes": [],
    "reason": ""
  }
}
